full job title,Field 16,address,alt address,phone,alt phone,fax,alt fax,email
Adams County Board Attorney,Scott Slover," 314 State St, Natchez 39120",,(601) 442-0075,,(601) 442-9896,,
Alcorn County Board Attorney,Bill Davis," 511 N Franklin St, Corinth 38835",,(662) 396-4808,,(662) 396-4805,,
Amite County Board Attorney,Reggie Jones," PO Box 436, Liberty 39645 ",,(601) 657-4113,,(601) 657-4802,,
Attala County Board Attorney,L. Scott Pickle,"PO Box 701, Kosciusko 39090",,(662) 289-8888,,(662) 289-8889,,
Benton County Board Attorney,John S Farese," PO Box 98, Ashland 38603 ",,(662) 224-6211,,(662) 224-6303,,
Bolivar County Board Attorney,Ellis Turnage," PO Box 216, Cleveland 38732",,(662) 843-2811,,(662) 843-3972,,
Calhoun County Board Attorney,"Haven (""Sonny"") Clanton Jr.","PO Box 630, Calhoun City 38916",,(662) 628-4933,,(662) 628-4030,,
Carroll County Board Attorney,M. Kevin Horan,"PO Box 2166, Grenada 38902-2166",,(662) 226-2185,,(662) 226-2127,,
Chickasaw County Board Attorney,Gary Carnathan ,"316 N Boradway St, Tupelo 38804",,(662) 842-3321,,,,
Choctaw County Board Attorney,Kacey Young,"PO Box 250, Ackerman 39735",,(662) 285-6329,,(662) 285-3444,,
Claiborne County Board Attorney,Barbara Blackmon," 907 Peace St, Canton 39046",,(601) 859-1567,,(601) 859-2311,,
Clarke County Board Attorney,Greg Snowden," PO Box 3807, Meridian 39303-3807",,(601) 693-5700,,,,
Clay County Board Attorney,Bob Marshall," PO Box 835, West Point 39773.",,(662) 494-5184,,(662) 492-4059,,
Coahoma County Board Attorney,Tom Ross Jr.," PO Box 1196, Clarksdale 38614",,(662) 627-5251,,,,
Copiah County Board Attorney,Elise Munn,"P. O. Drawer 768, Hazlehurst 39083",,(601) 894-4150,,(601) 894-4717,,
Covington County Board Attorney,Tommy Rogers," PO Box 1415, Collins 39428",,(601) 765-8235,,(601) 765-8237,,
DeSoto County Board Attorney,Tony Nowak," 2545 Caffey St, Hernando 38632",,(662) 429-7888,,(662) 429-0107,,
Forrest County Board Attorney,David Miller," PO Box 1310, Hattiesburg 39403-1310 ",,(601) 545-6006,,(601) 545-6172,,
Franklin County Board Attorney,"William (""Bill"") Halford"," 85 Main St. W, Meadville 39653",,(601) 384-2100,,(601) 384-2121,,
George County Board Attorney,Robert Shepard,"922 Manila St, Lucedale 39452",,(601) 947-7575,,,,
Greene County Board Attorney,Roun McNeal," PO Box 667, Leakesville 39451",,(601) 394-2394,,(601) 394-4650,,
Grenada County Board Attorney,Jay Gore III," PO Box 901, Grenada 38902",,(662) 226-1891,,(662) 226-2237,,
Hancock County Board Attorney,Gary Yarborough," 854 Hwy. 90,Ste A, Bay St. Louis 39520",,(228) 467-5771,,,,
Harrison County Board Attorney,Tim Holleman," 1720 23rd Ave, Gulfport 39501 ",,(228) 863-3142,,,,
Hinds County Board Attorney,Pieter Teeuwissen,"PO Box 686, Jackson 39205",,(601) 968-6797,,(601) 968-6594,,
Holmes County Board Attorney,Katherine B. Riley," PO Box 927, Lexington 39095",,(662) 834-2488,,(662) 834-6136,,
Humphreys County Board Attorney,Willie Bailey,"PO Box 189, Greenville 38702",,(662) 335-1966,,(662) 335-1969,,
Issaquena County Board Attorney,Charles Weissinger," PO Box 215, Rolling Fork 39159",,(662) 873-6258,,(662) 873-6903,,
Itawamba County Board Attorney,Bo Russell," PO Box 187, Fulton 38843",,(662) 862-4656,,(662) 862-7159,,
Jackson County Board Attorney,Gary Evans," PO Box 998, Pascagoula 39568-0998",,(228) 769-3371,,(228) 769-3119,,
Jasper County Board Attorney,William Ruffin,"PO Box 565, Bay Springs 39422 ",,(601) 764-4555,,(601) 764-2234,,
Jefferson County Board Attorney,Everett SanderS ,"PO Box 565, Natchez 39121",,(601) 445-5570,,(601) 445-0777,,
Jefferson Davis County Board Attorney,Wes Daughdrill," PO Box 6005, Ridgeland 39158-6005",,(601) 792-8591,,(601) 792-0311,,
Jones County Board Attorney,M. Wayne Thompson," PO Box 6509, Laurel 39441",,(601) 426-0056,,(601) 426-0058,,
Kemper County Board Attorney,"Robert (""Bo"") Bailey","PO Box 188, DeKalb 39328 ",,(601) 743-4477,,(601) 743-5273,,
Lafayette County Board Attorney,David O’Donnell," PO Drawer 676, Oxford 38655",,(662) 234-0900,,,,
Lamar County Board Attorney,Perry Phillips,"PO Box 1978, Purvis 39475",,(601) 794-4545,,(601) 794-1049,,
Lauderdale County Board Attorney,Rick Barry,"PO Box 2009, Meridian 39302",,(601) 693-2393,,(601) 482-9744,,
Lawrence County Board Attorney,John D. Sutton," PO Box 1157, Monticello 39654",,(601) 587-7900,,(601) 587-7916,,
Leake County Board Attorney,Jeff Webb,"PO Box 452, Carthage 39051",,(601) 267-9762,,(601) 267-6132,,
Lee County Board Attorney,Gary Carnathan  ,"PO Box 70, Tupelo 38802",,(662) 842-3321,,(662) 842-3324,,
Leflore County Board Attorney,Joyce Chiles," PO Box 250, Greenwood 38935",,(662) 822-5940,,(662) 455-7965,,
Lincoln County Board Attorney,Robert Allen,"PO Box 751, Brookhaven 39602",,(601) 833-4361,,(601) 833-6647,,
Lowndes County Board Attorney,Tim Hudson," PO Box 1364, Columbus 39703 ",,(662) 328-2711,,(662) 328-0745,,
Marion County Board Attorney,Joseph Shepard ,"PO Box 747, Columbia 39429",,(601) 736-1122,,(601) 736-1232,,
Marshall County Board Attorney,Kent Smith," PO Box 849, Holly Springs 38635",,(662) 252-3003,,(662) 252-3006,,
Monroe County Board Attorney,David W Houston III  ,"PO Box 72, Aberdeen 39730",,(662) 620-6219,,,,
Montgomery County Board Attorney,Alan Lancaster," PO Box 71, Winona 38967.",,(662) 283-2132,,(662) 283-2233,,
Neshoba County Board Attorney,Wade White,"PO Box 459, Philadelphia 39350",,(601) 656-2451,,(601) 656-2458,,
Newton County Board Attorney,Jason Mangum," PO Box 85, Decatur 39327.",,(601) 635-3432,,(601) 635-3479,,
Noxubee County Board Attorney,Chris D. Hemphill,"PO Drawer 866, Columbus 39703",,(662) 327-4211,,,,
Oktibbeha County Board Attorney,Jackson M. Brown,"PO Box 57, Starkville 39760-2257",,(662) 323-4126,,(662) 323-4188,,
Panola County Board Attorney,William McKenzie III  ,"PO Box 837, Batesville 39606",,(662) 563-3536,,(662) 563-2566,,
Pearl River County Board Attorney,Joe Montgomery," PO Box 113, Poplarville 39470",,(601) 795-4572,,(601) 795-8382,,
Perry County Board Attorney,Paul Walley  ,"PO Box 183, New Augusta 39642",,(601) 964-7878,,(601) 964-7879,,
Pike County Board Attorney,Wayne Dowdy," PO Box 30, Magnolia 39652",,(601) 783-6600,,(601) 783-3670,,
Pontotoc County Board Attorney,Phillip Tutor," PO Box 487, Pontotoc 38863",,(662) 489-2415,,(662) 489-6815,,
Prentiss County Board Attorney,Tommy Cadle," 101 South Main, Booneville 38829",,(662) 728-2131,,(662) 728-2007,,
Quitman County Board Attorney,Robert Roy,"PO Drawer 250, Marks 38646",,(662) 326-8530,,(662) 326-2754,,
Rankin County Board Attorney,Craig L. Slay,"211 E Government St,Ste A, Brandon 39042",,(601) 824-2437,,(601) 825-0431,,
Scott County Board Attorney,Roy Noble Lee Jr.," PO Box 370, Forest 39074",,(601) 469-2721,,(601) 469-4216,,
Sharkey County Board Attorney,Allen S Woodard,"PO Box 10, Rolling Fork 39159",,(662) 873-6777,,(662) 873-9000,,
Simpson County Board Attorney,Danny Welch," 224 N Main St, Mendenhall 39114",,(601) 847-2539,,(601) 847-4449,,
Smith County Board Attorney,Wendell James ,"PO Box 302, Taylorsville 39168 (601) 452-5055",,(601) 452-5055,,(601) 452-5056,,
Stone County Board Attorney,Scott Gibson,"PO Box 1270, Wiggins 39577",,(601) 528-6028,,,,
Sunflower County Board Attorney,John H. McWilliams," PO Box 288, Drew 38737",,(662) 745-8517,,(662) 745-8518,,
Tallahatchie County Board Attorney,Thomas U. Reynolds  ,"PO Box 220, Charleston 38921",,(662) 647-3203,,(662) 647-2811,,
Tate County Board Attorney,"Lamar & Hannaford, P.A"," 214 S Ward St, Senatobia 38668",,(662) 562-6537,,(662) 562-4858,,
Tippah County Board Attorney,B. Sean Akins,"108 Jefferson St, Ripley 38663",,(662) 837-9976,,(662) 837-1009,,
Tishomingo County Board Attorney,Phillip Whitehead," 1008 Battleground Dr, Iuka 38852",,(662) 423-7032,,(662) 423-7005,,
Tunica County Board Attorney,John K.Perry,"5699 Getwell Bldg. G5, Southaven 38672",,(662) 536-6868,,,,
Union County Board Attorney,Chandler Rogers," 201 E Bankhead St, New Albany 38652",,(662) 538-5990,,(662) 534-5205,,
Walthall County Board Attorney,Conrad Mord," PO Box 311, Tylertown 39667",,(601) 876-2611,,(601) 876-4379,,
Warren County Board Attorney,B. Blake Teller," 1201 Cherry St, Vicksburg 39183",,(601) 636-6565,,(601) 631-0114,,
Washington County Board Attorney,Frank Power,"PO Box 1856, Greenville 38702 ",,(662) 335-6011,,(662) 334-6407,,
Wayne County Board Attorney,Cooper Leggett,"PO Box 384, Waynesboro 39367",,(601) 735-4920,,(601) 735-3859,,
Webster County Board Attorney,Buchanan Meek Jr.," PO Box 555, Eupora 39744 ",,(662) 258-3521,,(662) 258-6657,,
Wilkinson County Board Attorney,William Bruce Lewis ," 319 Market St, Natchez 39120",,(601) 446-6621,,(601) 442-6175,,
Winston County Board Attorney,Hugh Hathorn,"PO Box 39, Louisville 39339",,(662) 773-8181,,(662) 773-8485,,
Yalobusha County Board Attorney,John J. Crow Jr.," 203 Wagner St, Water Valley 38965",,(662) 473-1870,,(662) 473-2030,,
Yazoo County Board Attorney,Jay Barbour ,"PO Box 1569, Yazoo City 39194",,(662) 746-2134,,(662) 746-2167,,